title,url,thumbnail,date
U of T researchers say 'unusual' metamaterial could double capacity of wireless networks,https://www.utoronto.ca/news/u-t-researchers-say-unusual-metamaterial-could-double-capacity-wireless-networks,https://www.utoronto.ca/sites/default/files/styles/750x500/public/Wi-fi-GettyImages.jpg?itok=jYIZjp5z,September 27
'An essential resource': U of T course focuses on Black mental health,https://www.utoronto.ca/news/essential-resource-u-t-course-focuses-black-mental-health,https://www.utoronto.ca/sites/default/files/styles/750x500/public/Akwatu_DallaLana_02.jpeg?itok=6snTEnMk,September 27
"'Letters to Amelia': Alumna's debut novel features letter-writing, an aviation pioneer – and U of T",https://www.utoronto.ca/news/letters-amelia-alumna-s-debut-novel-features-letter-writing-aviation-pioneer-and-u-t,https://www.utoronto.ca/sites/default/files/styles/750x500/public/Smithsonian-crop.jpg?itok=MWC3qxlb,September 27
Student-built dashboard aims to more accurately track global COVID-19 infections,https://www.utoronto.ca/news/student-built-dashboard-aims-more-accurately-track-global-covid-19-infections,https://www.utoronto.ca/sites/default/files/styles/750x500/public/serotracker.JPG?itok=V7R9Euyf,September 24
"If robots need to persuade humans, they shouldn't resemble authority figures: U of T study",https://www.utoronto.ca/news/if-robots-need-persuade-humans-they-shouldn-t-resemble-authority-figures-u-t-study,https://www.utoronto.ca/sites/default/files/styles/750x500/public/UofT84217_160A8651-crop.jpg?itok=ukDsZfBw,September 24
And the nominees are ... U of T student examines whether Tony Award nods boost Broadway ticket sales,https://www.utoronto.ca/news/and-nominees-are-u-t-student-examines-whether-tony-award-nods-boost-broadway-ticket-sales,https://www.utoronto.ca/sites/default/files/styles/750x500/public/sudan-ouyang-UQuka_ruWxQ-unsplash-crop.jpg?itok=plS5HUfh,September 24
